{
  "schema_version": 3,
  "author_agent_id": "Codex_dev_20260823",
  "id": "cadrage-filtre-etats-1",
  "feature_id": "filtre-features-etat",
  "type": "cadrage_essentiel",
  "sequence": 1,
  "created_at": "2026-08-23T09:00:00.000Z",
  "depends_on_document_ids": [],
  "probleme": "Le cockpit Project liste toutes les Features sans pouvoir les filtrer par état, ce qui rend la priorisation lente dès qu'un Project dépasse une dizaine de Features.",
  "objectif": "Un utilisateur identifie en quelques frappes les Features qui réclament son attention (failed, invalid, incomplete) sans lire chaque ligne du cockpit.",
  "resultat_attendu": "Le menu Project accepte un filtre texte d'état et le résumé reflète la sélection active.",
  "perimetre": {
    "inclus": ["filtre par état dans la vue Project", "raccourci clavier dédié", "résumé filtré"],
    "exclus": ["filtres sauvegardés", "tri multi-colonnes", "refonte du moteur de rendu"]
  },
  "zones_impactees": ["src/adapters/inbound/tui/views/project-detail-view.ts", "tests TUI"],
  "lots": [
    { "id": "L1", "titre": "Filtre d'état dans le menu Project", "depend_de": [] },
    { "id": "L2", "titre": "Résumé et aide contextuelle du filtre", "depend_de": ["L1"] }
  ],
  "criteres_acceptation": [
    { "id": "C-CODE", "dimension": "code", "critere": "Le filtre passe par le composant de menu existant sans contournement.", "preuve_attendue": "test unitaire du composant" },
    { "id": "C-FONC", "dimension": "fonctionnel", "critere": "Saisir un état filtre la liste et Échap restaure la liste complète.", "preuve_attendue": "test de navigation clavier" },
    { "id": "C-UX", "dimension": "ux", "critere": "Le filtre actif reste visible et le résumé reflète la sélection.", "preuve_attendue": "assertion de rendu" },
    { "id": "C-SEC", "dimension": "securite", "critere": "Aucune saisie de filtre n'est interprétée comme un chemin ou une commande.", "preuve_attendue": "revue du chemin de données" }
  ],
  "tests_attendus": ["tests unitaires TUI", "test de navigation clavier complet"],
  "risques": [
    { "id": "R-1", "risque": "Le filtre masque l'action recommandée et désoriente.", "mitigation": "Conserver l'action recommandée au-dessus de la liste filtrée." }
  ],
  "definition_de_fini": ["critères C-CODE à C-SEC prouvés", "audit de livraison pass", "validation pass sur le dernier CR"],
  "decisions": [
    { "id": "D-1", "sujet": "Périmètre du filtre", "decision": "Filtre par libellé d'état exact uniquement, pas de préfixe.", "justification": "Les états du rapport sont un ensemble fini et stable." },
    { "id": "D-2", "sujet": "Persistance", "decision": "Le filtre ne survit pas au changement de Project.", "justification": "Éviter un état caché difficile à auditer en TUI." }
  ],
  "invariants": [
    { "id": "INV-1", "enonce": "Le filtre ne modifie jamais l'ordre de tri des Features, seulement leur visibilité." }
  ]
}
